id,ticker,publisher,title,author,date,description,sentiment,sentiment_reasoning
110ffda86088ba9c7608f98006688350e976a2711403032b68b85db4ac29355f,NVDA,Investing.com,AMD Gets a Valuation Reset as Meta Commits to Multi-Year AI Supply,Timothy Fries,2026-02-23,"AMD shares surged 9% following a landmark $60 billion, five-year strategic partnership with Meta to supply up to 6 gigawatts of AMD Instinct GPUs for Meta's AI infrastructure. The deal includes Meta receiving warrants for 160 million AMD shares, positioning Meta as a major stakeholder. This agreement, combined with a similar deal with OpenAI, solidifies AMD's position as Nvidia's primary competitor in the AI accelerator market.",negative,"AMD's landmark deal with Meta, a major AI infrastructure buyer, strengthens AMD as a viable alternative to Nvidia's dominance in the AI accelerator market, potentially eroding Nvidia's market share in this critical segment."
a9861774784a5d1db530723a1fa030c6f7cec8785287cb4430ba661010cf8922,AAPL,The Motley Fool,5 Warren Buffett Stocks to Hold Forever,Justin Pope,2026-02-23,"The article highlights five stocks from Warren Buffett's portfolio recommended for long-term holding: Apple, Coca-Cola, Chevron, Visa, and Domino's Pizza. These companies are praised for their strong brand power, dividend growth histories, competitive advantages, and ability to generate steady cash flows over decades.",positive,"Strong ecosystem with 2.5 billion active iOS devices, 12 consecutive years of dividend increases, and significant AI growth potential with new device integration opportunities."
f95c71d1c8a790049526b41852d9997731e4831b1578b3e271abffe2965f2c1a,GOOGL,The Motley Fool,Billionaire Investor Bill Ackman Has Nearly 40% of His Hedge Fund Invested in Just 3 Artificial Intelligence (AI) Stocks,Bram Berkowitz,2026-02-23,"Bill Ackman's Pershing Square Capital Management has concentrated nearly 40% of its portfolio in three AI stocks: Alphabet (14%+ allocation), Amazon (recent stake), and Meta Platforms ($1.8 billion position as of Q4 2025). Ackman believes these companies represent compelling valuations and strong AI positioning, though valuations have risen and execution risks remain.",positive,"Ackman holds over 14% of fund capital in Alphabet. The company benefited from favorable antitrust ruling, successful Gemini AI deployment, and custom TPU chips providing cost advantages. However, valuation at 28x forward earnings is above historical average, limiting upside potential."
42fef2a6e0fc1f502313f5eac52e8231b5eb6fdaa673fb13a2a1d964e5b6a53d,MSFT,Investing.com,AirJoule Has Big Partners—So What’s Still Holding the Stock Back?,Thomas Hughes,2026-02-23,"AirJoule Technologies, a pre-revenue company focused on efficient cooling and water harvesting using chemical processes, is positioned as a speculative buy despite execution risks. With major partnerships including GE Vernova, Carrier Global, and BASF, plus work with Google and Microsoft, the company expects to begin sales in 2026. Four of five analysts rate it as Buy, with consensus price targets suggesting nearly 200% upside. Strong insider ownership (40%+) and institutional buying support the stock, though it faces technical hurdles and depends on validating its product in the data center market.",positive,Partnership on cooling and water generation for data centers demonstrates major tech company's interest in AirJoule's solution for AI infrastructure needs.
64218fcbb48950c533573c5239f89accbcfae6c3631d2d4fe62c7df8731a58fe,AMZN,The Motley Fool,"Billionaire Investor Stanley Druckenmiller Eliminated His Fund's Position in Meta Platforms and Piled into Another ""Magnificent Seven"" Stock That's Been Getting Crushed by the Broader Market",Bram Berkowitz,2026-02-23,"Billionaire investor Stanley Druckenmiller's Duquesne Family Office eliminated its Meta position in Q4 2025 and significantly increased its Amazon stake by 69% to $170 million, also purchasing 100,000 call options. While Meta has faced challenges, its recent earnings showed promise with strong AI-driven ad improvements. Amazon, down 9% over the past year due to tariff concerns and questions about its AI strategy, trades at a relatively cheap valuation and benefits from its strong e-commerce and cloud businesses.",positive,"Druckenmiller significantly increased his position by 69% and purchased 100,000 call options, indicating strong conviction. Despite being down 9% over the past year due to tariffs and AI strategy concerns, the article highlights attractive valuation (29x trailing earnings), leadership in robotics, and durable business fundamentals in e-commerce and cloud."
8cd7e30d5ffae7e4cae406abd06fe29e09d0d16428cc43b77f373403ed742610,AVGO,The Motley Fool,Prediction: 2 Artificial Intelligence (AI) Chip Stocks That Will Soar After Feb. 25 (Hint: Not Nvidia),Adam Spatacco,2026-02-23,"With big tech planning to spend $680 billion on AI infrastructure in 2026, the article identifies two semiconductor stocks positioned to benefit alongside Nvidia: Broadcom, which supplies networking and custom silicon chips for AI data centers, and Micron Technology, whose memory chips are becoming critical as AI workloads scale. Micron's high-bandwidth memory inventory is already sold out for 2026, with Wall Street projecting earnings could quadruple this year.",positive,"Positioned as a key beneficiary of AI infrastructure expansion due to its networking switching chips (Tomahawk, Jericho) that complement Nvidia GPUs and its leadership in custom ASICs for companies like Alphabet and Meta seeking vertical integration."
a6b1d708d32ddb1dc4be7538a567f9da67f5d000931209474d6e88fd550cee5b,TSLA,Benzinga,Tesla Sales Fall 17% In Europe As New Car Registrations Decline Nearly 4%—BYD Continues Momentum With 165% Surge,Badar Shaikh,2026-02-23,"Tesla's European sales declined 17% year-over-year in January 2026, selling 8,075 units and losing market share from 1.0% to 0.8%. Meanwhile, BYD surged 165% with 18,242 units sold, capturing 1.8% of the European market. Overall EU new car registrations fell 3.9%, though battery electric vehicles grew 13.9% and now represent 19.3% of the market.",negative,"Tesla experienced a 17% year-over-year sales decline in Europe, lost market share (from 1.0% to 0.8%), and stock price declined 2.91% at market close. The company is losing ground to competitors despite the overall EV market growing."
6f25046e1957bae519c90baa8b15e63a4c3b88637c13cf06bb049c2d8cf12fa4,BRK.B,The Motley Fool,3 Vanguard ETFs to Buy That Are Crushing the S&P 500 in 2026,Daniel Foelber,2026-02-23,"While the S&P 500 remains flat year-to-date, value-focused Vanguard ETFs are outperforming due to strength in financials, industrials, energy, and materials sectors. The Vanguard Value ETF (VTV), Mega Cap Value ETF (MGV), and High Dividend Yield ETF (VYM) offer different approaches to value investing with low expense ratios and attractive dividend yields compared to the broader market.",positive,"Major holding in value ETFs, established company with proven long-term performance"
f6e03b7daf95d95df6352ae76c3435efa20cc7966f96c14c585830f49cba51b2,WMT,Investing.com,3 Major Buybacks Just Dropped—Here’s the Signal Investors See,Leo Miller,2026-02-23,"Walmart, Lyft, and Equitable have announced major share repurchase programs totaling billions of dollars, signaling confidence in their business outlooks. Walmart authorized a $30 billion buyback (its largest), Lyft announced a $1 billion program (17.8% of market cap), and Equitable launched a $1 billion buyback (8% of market cap). These aggressive capital return strategies aim to reduce share counts and support earnings per share growth in 2026.",positive,"Strong 2025 performance with 24% total return, robust e-commerce growth (24% YOY), record advertising revenue (+37%), and announced largest-ever $30 billion buyback authorization plus 5% dividend increase demonstrate solid financial health and shareholder-friendly capital allocation."
f01024d0014a9ab7fad67886fb027a138647ac8083cbaa536257d913e61837e3,LLY,Benzinga,Novo Nordisk's China Obesity Drug Cuts Nearly One-Fifth Of Body Weight,Vandana Singh,2026-02-23,"Novo Nordisk and United Laboratories announced positive phase 2 trial results for UBT251, a triple agonist obesity drug, showing 19.7% body weight loss in Chinese patients. However, the news comes after Novo Nordisk's stock plunged due to disappointing results from its REDEFINE 4 trial, where CagriSema failed to demonstrate non-inferiority against Eli Lilly's tirzepatide.",positive,"Competitor's tirzepatide and retatrutide drugs continue to outperform in clinical trials. Novo Nordisk's CagriSema failed to demonstrate non-inferiority against Eli Lilly's tirzepatide, strengthening Eli Lilly's competitive position in obesity market."
d6cfb78cd893ee5de47765e1a39e2c7e717ba29bc124fae31cbec0061a1a30de,XOM,GlobeNewswire Inc.,"Metalworking Fluids Market Worth USD 21.85 Billion by 2033, Driven by Rising Precision Manufacturing Demand | SNS Insider",Sns Insider,2026-02-23,"The global metalworking fluids market is projected to grow from USD 14.14 billion in 2025 to USD 21.85 billion by 2033, at a CAGR of 5.62%. Growth is driven by increasing demand for precision machining, automation, and advanced fluid formulations. The U.S. market is expected to expand from USD 2.45 billion to USD 4.06 billion by 2033. Synthetic fluids and aerospace applications are emerging as the fastest-growing segments.",positive,"Company unveiled new synthetic metalworking fluids for high-speed machining in September 2025, demonstrating innovation and alignment with market growth trends toward advanced fluid formulations."
a9861774784a5d1db530723a1fa030c6f7cec8785287cb4430ba661010cf8922,V,The Motley Fool,5 Warren Buffett Stocks to Hold Forever,Justin Pope,2026-02-23,"The article highlights five stocks from Warren Buffett's portfolio recommended for long-term holding: Apple, Coca-Cola, Chevron, Visa, and Domino's Pizza. These companies are praised for their strong brand power, dividend growth histories, competitive advantages, and ability to generate steady cash flows over decades.",positive,"Leading payment network with toll-collector business model, 16 consecutive years of dividend increases, inflation-protected revenue through percentage-based fees, and continued cash flow generation."
6f25046e1957bae519c90baa8b15e63a4c3b88637c13cf06bb049c2d8cf12fa4,JNJ,The Motley Fool,3 Vanguard ETFs to Buy That Are Crushing the S&P 500 in 2026,Daniel Foelber,2026-02-23,"While the S&P 500 remains flat year-to-date, value-focused Vanguard ETFs are outperforming due to strength in financials, industrials, energy, and materials sectors. The Vanguard Value ETF (VTV), Mega Cap Value ETF (MGV), and High Dividend Yield ETF (VYM) offer different approaches to value investing with low expense ratios and attractive dividend yields compared to the broader market.",positive,"Top holding in value ETFs, healthcare leader with stable dividend history"
8cd7e30d5ffae7e4cae406abd06fe29e09d0d16428cc43b77f373403ed742610,MU,The Motley Fool,Prediction: 2 Artificial Intelligence (AI) Chip Stocks That Will Soar After Feb. 25 (Hint: Not Nvidia),Adam Spatacco,2026-02-23,"With big tech planning to spend $680 billion on AI infrastructure in 2026, the article identifies two semiconductor stocks positioned to benefit alongside Nvidia: Broadcom, which supplies networking and custom silicon chips for AI data centers, and Micron Technology, whose memory chips are becoming critical as AI workloads scale. Micron's high-bandwidth memory inventory is already sold out for 2026, with Wall Street projecting earnings could quadruple this year.",positive,High-bandwidth memory inventory already sold out for 2026 with Wall Street projecting earnings could quadruple; trading at forward P/E of 12 (half the Nasdaq-100 average) suggests significant upside potential as memory becomes mission-critical for scaling AI workloads.
9b6b6e9f65fbb5f4d349cfcc96b5ca77c8b2a19af4d0a50483a7d38cd4b72386,MA,The Motley Fool,Here's How Fiserv Stock Beats the Market From Here,Jennifer Saibil,2026-02-23,"Fiserv stock has plummeted 73% over the past year after missing earnings expectations, but the company's new CEO Mike Lyons is implementing the 'One Fiserv' turnaround plan focused on AI integration and technology innovation. The company demonstrated stability in its Q4 report with flat revenue, and investors will be watching for signs of renewed growth through higher revenue and raised guidance as the company moves beyond stabilization.",positive,"Mastercard is highlighted as a partner bringing agentic AI to Fiserv's merchant base, representing a strategic collaboration that supports Fiserv's growth and innovation initiatives."
a7e6244e7d7b02d7ac4bb5e2475ab39bcc9e1b848450f5cf8ebf0a9b578852b0,COST,The Motley Fool,"Costco Stock Is Soaring, but Is It Getting Ahead of Itself?",John Ballard,2026-02-23,"Costco's stock has surged 15% year-to-date following strong January sales with 34% digital growth. However, the stock trades at a P/E multiple of 53, which appears expensive given the company's modest single-digit total sales growth (9% YoY) and earnings growth of only 9% annually. The valuation seems disconnected from fundamentals, with analysts suggesting investors should wait for a better entry point.",negative,"While the company demonstrates strong operational execution with impressive 34% digital sales growth and consumer spending on high-margin items, the stock is trading at an unjustifiably high P/E multiple of 53 relative to its modest 9% earnings growth. The article argues the valuation is disconnected from fundamentals and recommends caution, suggesting investors wait for a lower entry point."
948fc83fe9663a3da13a25f13eea32007083f801ddaf31de47234004c8fb3421,ABBV,Benzinga,FDA Approval For AbbVie/AstraZeneca's Combination Treatment Could Set New Standard For Slow Growing Blood Cancer,Vandana Singh,2026-02-23,"The FDA approved AbbVie and AstraZeneca's combination treatment (Venclexta and Calquence) for chronic lymphocytic leukemia (CLL), the first all-oral, fixed-duration option for previously untreated patients. The AMPLIFY Phase 3 trial showed 77% of patients were progression-free at three years versus 67% with standard chemotherapy, with a 35% reduced risk of disease progression or death.",positive,"FDA approval of combination treatment represents a significant milestone for the company, providing a new targeted therapy option for CLL patients. Strong Phase 3 trial results (77% progression-free at 3 years) and analyst Buy rating with $238.47 price target support positive outlook, though stock underperformance relative to healthcare sector suggests market may not have fully priced in the approval."
c247340d541cd2e15c92c0d4381cc80e6f5ea5015808f39c92f24fca80a69c29,BAC,The Motley Fool,"Move Over, Apple: Berkshire Hathaway Is on Track to Have a New No. 1 Holding Following Warren Buffett's Retirement",Sean Williams,2026-02-23,"Following Warren Buffett's retirement as CEO, Berkshire Hathaway's investment portfolio is undergoing significant changes. Buffett sold 687 million Apple shares in nine quarters before his departure, reducing the stake by 75%. American Express is poised to become Berkshire's largest holding, currently valued at $51.95 billion compared to Apple's $59.39 billion, as Buffett designated Amex as an 'indefinite' holding with no plans to sell.",neutral,Mentioned as a significant holding alongside Apple representing a large portion of Berkshire's unrealized gains and selling activity. No specific positive or negative thesis provided in the article.
181cfec01ece3c7a2343d953c5ee6bd7eef1f74358958e60325209e4bb7cea41,HD,GlobeNewswire Inc.,"Salvation Army Relocates to Woodbridge Shopping Center, Reaffirming Long-Term Commitment to the Woodbridge Corridor",Na,2026-02-23,"Salvation Army has relocated from Gordon Plaza to a new 19,000 square foot space at Woodbridge Shopping Center in Virginia, positioned at the corner of Route 1 and Occoquan Road. The move follows Gordon Plaza's closure for redevelopment and allows Salvation Army to maintain its presence in the Woodbridge corridor with improved visibility and traffic. The shopping center is co-anchored by CVS and Dixie Bones.",neutral,"Home Depot is mentioned as part of the Gordon Plaza redevelopment project with expected delivery in 2027, but no direct impact or sentiment indicators are provided regarding the company itself."
9f921ee8f52188ef223bbaffae73f72696bae2b67631da8ae30712b4961941c3,PG,Investing.com,"Sell the Leaders, Buy the Laggards: The Rotation Trade in Full Swing",David Moenning,2026-02-23,"A major rotation trade is underway in 2026, with investors selling high-growth megacap tech stocks and buying defensive/value stocks. However, the author argues that value stocks have become significantly overvalued with P/E multiples exceeding those of tech companies, despite much lower growth rates. The author suggests this rotation trade has limitations and may eventually reverse.",negative,Included in defensive/value rotation trade that author views as overvalued relative to growth fundamentals
76c85283aea4b9555356a241d0c0097c49714412c2b91fbeb8c4661201d343ca,NFLX,Benzinga,"UK To Regulate Streaming Services Like Netflix, Amazon Prime, Disney+ Like Traditional Broadcasters",Namrata Sen,2026-02-23,"The UK government has brought streaming platforms under Ofcom's broadcasting code jurisdiction. Major streaming services must now provide subtitles for 80% of content, audio descriptions for 10%, and signed content for 5%. Services with over 500,000 UK users must also ensure accurate and impartial news coverage, aligning streaming regulation with traditional broadcasters.",neutral,"New regulatory requirements impose compliance costs and operational constraints, but Netflix is already a major UK investor ($6B over 4 years) with established infrastructure, suggesting capacity to meet standards without significant disruption."
